"Smoothie","breakfast","1","","1 medium banana (fresh or frozen)\n0.5 cup sliced strawberries, blueberries, or chopped mangos\n0.25 cup 2% plain Greek yogurt\n1 tablespoon almond butter\n½ cup baby spinach\n½ cup unsweetened almond milk\nOptional: 1-2 basil leaves\n2-3 mint leaves\n½ teaspoon peeled\nchopped ginger \n\nPlace in blender and blend until smooth"
"Ramen","lunch","1","","Sesame oil\nOlive oil (or avocado oil)\nGarlic\nFresh ginger\nChicken or vegetable broth\nRice vinegar\nLow sodium soy sauce\nSriracha or hot chili garlic sauce, like Sambal Oelek\nShredded carrots\nShiitake mushrooms (optional)\nScallions\nSesame seeds\nSoft-boiled egg \n\nHeat sesame oil and olive oil in a medium-large saucepan over moderate heat (see notes). Add garlic and ginger, and simmer until fragrant, about 2-3 minutes. Do not brown the garlic, or else you'll get a bitter flavor. Add the carrots and mushrooms if you're using them, and simmer until they soften, about a minute, stirring frequently. Add the broth, Sriracha sauce, rice vinegar, and soy sauce. Stir, and bring to a simmer; let it go for about five minutes. Taste, and adjust heat and taste to your liking by adding more Sriracha and soy sauce if needed. While the broth simmers, cook the Ramen noodles in a separate pot as per the package's instructions. (You could cook the noodles in the broth directly, but that makes for a messy transfer to a bowl. It's much easier to transfer drained cooked noodles to a bowl and spoon the broth over top.) Once the noodles are tender, drain and rinse under cool water, place into a soup bowl, and set aside. When the soup is ready, spoon the broth over the noodles. Allow to cool. At this point, make your soft-boiled egg if you're garnishing with one, and add the rest of your toppings to serve. Soft-Boiled Egg - Bring water to a boil in a small saucepan. Add the egg(s), and let them boil for five minutes. In the meantime, prepare an ice bath in a bowl. Once five minutes are up, remove the egg(s) and dunk them into the ice bath for about a minute to cool them off enough to handle. Then, lightly crack and roll them on a flat surface, peel, slice in half, and place on top of your Ramen."
"Caprese Mac N Cheese","dinner","1","","milk\ncheese\nspinach\nsalt\nbutter\nflour\nmacaroni\npepper\npaprika\ntomato\nbasil \n\nMake a quick sauce with flour, butter, milk, and cheese — then throw in cooked pasta. Fold in some spinach, top with some more cheese, and bake until bubbling. Dress it up: Before baking, top with sliced tomatoes and fresh mozzarella — and as soon as it comes out of the oven, garnish with torn basil."
"Avocado Chips","snack","1","","1 large ripe avocado\n¼c freshly grated Parmesan\n1 tsp lemon juice\n½ tsp garlic powder\n½tsp italian seasoning\nkosher salt\nfreshly ground black pepper \n\nPreheat oven to 325° and line two baking sheets with parchment paper. In a medium bowl, mash avocado with a fork until smooth. Stir in Parmesan, lemon juice, garlic powder, and Italian seasoning. Season with salt and pepper. Place heaping teaspoon-size scoops of mixture on baking sheet, leaving about 3” apart between each scoop. Flatten each scoop to 3' wide across with the back of a spoon or measuring cup. Bake until crisp and golden, about 30 minutes, then let cool completely. Serve at room temperature."
"Pancakes","breakfast","2","","flour - 2 cups\nbaking powder - 3 tbsp\nsalt - 0.5 tsp\nsugar - 4 tbsp\nmilk - 2 cups\negg - 1\nvanilla extract - 1 tsp\noil - 1 tbsp\nbutter - for cooking\nmaple syrup - to taste\n\nMix dry ingredients in a bowl. Add milk, vanilla extract, egg yolk, and oil and mix to incorporate. Whisk egg white in a seperate bowl until soft peaks are formed, add to pancake batter and mix. Place a frying pan with a bit of butter on medium heat and ladle the pancake mixture onto the pan forming medium sized disks. Cook the pancakes for 2 minutes on each side. Serve with maple syrup."
"Cheesy Chicken Enchilada Quinoa Casserole","lunch","4","avocado,black pepper,canned black beans,canned tomatoes,chili powder,cooked quinoa,cumin,enchilada sauce,fresh cilantro,green onion tops,roma tomato,salt,shredded cheese,skinless boneless chicken breast,sweet corn,white pepper","To get started, heat your oven to 350 and prepare an 8x8 baking dish. Cook the quinoa according to the instructions. If you haven't already, boil and shred your chicken breast.In a medium sized mixing bowl add 2 Tbsp cilantro, 1 cup shredded cheese, quinoa, tomatoes with chilis, black beans, half of the can of sweet corn, verde enchilada sauce, cumin, chili powder, white pepper, black pepper, and salt to taste. Mix everything well, and then pour into the 8 x8 baking dish. Cover with the last cup of cheese and then bake in the oven for 15 minutes.Remove from oven and allow to cool for 5 minutes. Then top with chopped Roma tomato, chopped avocado, green onion tops, and remaining 2 tsp of cilantro. Serve immediately."
"Delicious Lemon Cake","lunch","1","baking powder,eggs,flour,milk,powdered sugar,salt,sugar,sugar,unsalted butter,water","Preheat oven to 350.Mix 1 cup sugar and butter together in a medium mixing bowl. Add in eggs.Add in 1 tbsp of the lemon water, mix well.Add milk, mix well.Add in salt, flour, and baking powder, mix well.Pour into a round 8" baking pan.Place in oven and bake for 30 minutes, or until you get a clean toothpick from the center.Allow to cool slightly.Mix  cup lemon water and  cup sugar. Drizzle over the top of the cake, and then sprinkle the top with powdered sugar."
"Bacon Wrapped Green Bean Bundles","side dish","6","fresh green beans,bacon,butter,brown sugar,garlic,soy sauce","Preheat oven to 425F. Grease a 1015 inch baking dish and set aside.\nWrap 8 or 9 green beans with a strip of bacon and place in prepared dish. Repeat.\nCombine butter, brown sugar, garlic, and soy sauce. Pour over green beans.\nBake in preheated oven for 25 to 30 minutes, or until bacon and green beans are browned and crispy."
"Hot Crab Dip","antipasti","4","cream cheese,milk,canned crabmeat,onion,horseradish,breadcrumbs,butter,salt","Add all ingredients to softened cream cheese, mix with fork\nPlace in small casserole dish\nCover with breadcrumbs and butter\nBake 375 for 15 minutes"
"Zucchini Chicken Omelette","lunch","2","eggs,water,zucchini,salt and pepper,oil,chicken","Beat eggs and water in a bowl. Mix in grated zucchini and season with salt and pepper. Heat the oil in a small, non-stick skillet. When hot, add half the egg mixture and cook for 1 minute until the egg begins to set. Scatter evenly with half diced chicken.\nCook for a further 1-2 minutes, until the egg is golden underneath, and just set on top. Slide out onto a serving plate, folding it over as you go. Repeat. Serve the omelette with your favourite salad."
"Valentine's Chicken Marsala","lunch","3","fresh mushrooms,skinless boneless chicken breast,garlic,butter,olive oil,seasoned breadcrumbs,marsala wine,heavy cream,cooked pasta","Slice mushrooms and pound chicken breast with a mallet between 2 sheets of wax paper to about 1/4 inch. Dredge breast in seasoned crumbs.\nHeat a heavy stainless or cast iron pan (don't use non-stick). Add the butter and the olive oil till butter melts and is bubbly. Add chicken breast and brown on both sides.\nRemove browned breast. Add additional olive oil and saute mushrooms and garlic.\nDeglaze pan with wine.\nAdd browned chicken breast back to pan. Bring to boil, reduce heat, cover and simmer for 30 min.\nRemove chicken from pan. Add cream and reduce sauce 50%.\nServe over cooked pasta, if desired."
"Almond Butter and Chocolate Squares","condiment","16","butter,powdered sugar,cookie crumbs,almond butter,vegan chocolate chips","Stir the melted butter, powdered sugar, graham cracker/vanilla crumbs, and almond butter together, until all of the ingredients are incorporated.\nLine a 9 x 13 inch dish with foil. Drape the foil over the sides of the dish so that you can easily remove it once the bars set. Press the mixture into the bottom of the dish.\nMelt the vegan chocolate in a double boiler and spread the chocolate over the almond butter mixture.\nWhile the chocolate is still warm, cut the bars. Allow to set for at least an hour."
"Chicken Enchilada Chowder","lunch","6","black beans,fire roasted tomatoes,onion,orange bell pepper,enchilada sauce,cream of chicken soup,milk,cream corn,green chiles,jalapeno,skinless boneless chicken breast,monterey jack cheese,shredded cheddar cheese,sour cream,tortilla chips","In a 5 quart slow cooker combine black beans, tomatoes, corn, onion, peppers and chilies. In a large bowl mix together the cream of chicken soup and enchilada sauce, gradually whisk in the milk until smooth. Lay the chicken on top of the veggie mixture and top with the soup mixture, cover and cook on low for 6-8 hours or on high for 3-4 hours. When the chowder is ready pull out the chicken and shred the meat, then place the meat back into the slow cooker and stir in the cheese. Let the chowder cook until all of the cheese is melted. Ladle into bowls and top with sour cream and tortilla chips."
"Chia Seed Pudding","side dish","3","agave syrup,almond milk,chia seeds,raspberries,salt,vanilla extract","<ol><li>Mix ingredients together in small bowl. Let sit overnight, top with your favorite berries and enjoy!</li></ol>"
"Cheddar Polenta With Bacon Wrapped Asparagus","lunch","1","asparagus spears,bacon,chicken broth,corn grits,extra sharp cheddar cheese,bell pepper,salt","<ol><li>Preheat the oven to 400. Wrap 6 thick asparagus spears with two slices of raw bacon.</li><li>Place on a small baking sheet and spritz the bundle with nonstick cooking spray, just to coat the asparagus lightly. Sprinkle with salt and pepper.</li><li>Roast for 15-20 minutes, or until the bacon is crispy and the asparagus is tender.</li><li>Make the cheddar polenta while the asparagus is roasting: Bring chicken broth to a boil in a small saucepan.</li><li>Stir in polenta.Lower the heat and cook slowly for 5 minutes, stirring occasionally until the mixture has thickened.</li><li>Stir in the cheese. I used extra sharp cheddar, but any kind would work. Add a dash of salt and pepper, or more to taste.</li><li>Scoop the polenta in a dish and top with the bacon wrapped asparagus.</li></ol>"
"Steaks with pesto, tomatoes and feta cheese","lunch","4","cherry tomatoes,feta cheese,capers,whole garlic cloves,pepper,olive oil,fresh basil,pork loin steaks,pesto,cornflour,dried basil,sea salt,black pepper,olive oil","Place the tomatoes on a baking tray lined with baking paper, scatter over capers, garlic cloves and crumbled fetta.\nSprinkle with olive oil and cracked pepper. Cook in oven at 200C for 30 minutes or until tomatoes are soft. Remove and set aside.\nSprinkle with fresh basil.\nMeanwhile, flaten the steaks with a meat mallet.\nSmear one side of each steak with  tablespoon of red pesto, make a roll (pesto side inside) and secure it with a wooden or metal toothpick.\nMix cornflour, dry basil, salt and pepper in a plate. Dredge the rolls through the flour mixture, shake off excess flour.\nIn a large skillet heat olive oil over medium-high heat, then brown the rolls for 5 -6, constantly turning them until golden all around.\nBefore serving, take out toothpick and serve with tomatoes, capers, garlic and fetta bake."
"Slow Cooker Chicken and Dumplings","lunch","6","butter,canned biscuits,condensed cream of chicken soup,flour,onion,parsley,pepper,poultry seasoning,skinless boneless chicken breasts,water","Place Slow Cooker on high.Add chicken breasts, butter, water, soup, flour, onion, poultry seasoning, pepper, and parsley. Stir and mix well. Cook on high for 4 hours. Take two forks and start shredding chicken in the mixture.After shredding chicken, tear small pieces of biscuit dough and place in slow cooker for remaining 2 hours. Stirring occasionally."
"Blueberry Vanilla Pie","lunch","1","almonds,blueberries,butter,egg,ground almonds,juice of lemon,lemon zest,plain flour,powdered sugar,salt,sugar,vanilla extract,vanilla pod,vanilla sugar,whipped cream,density,density","<ol><li>Dough:</li><li>Combine flour, sugar, salt, lemon zest and finely ground almonds.</li><li>Add the chopped butter to make the shortcrust dough.</li><li>Finally stir in the roughly chopped almonds.</li><li>Leave the dough for a short time/15minutes in the refrigerator, than roll it.</li><li>Or press it right away  into the mold and punch the dough with a fork.</li><li>Leave for 15 minutes in the freezer.</li><li>Preheat oven to maximum.</li><li>Custard:</li><li>Mix the egg with the vanilla sugar, add density and flavor of vanilla.</li><li>Half of vanilla pod put in cream and add to boil.</li><li>When boil remove the pod.</li><li>Scrape the seeds and add to the cream.</li><li>Remove cream from heat, stirring constantly and pour the egg mixture. Quite a short return to the fire that starts to thicken.</li><li>Leave aside to cool slightly.</li><li>Blueberries filling:</li><li>Half of blueberries mix with sugar, lemon juice and density.</li><li>Cook over medium heat stirring constantly, until it starts to thicken.</li><li>Set aside to cool.</li><li>Removethe mold from the freezer.</li><li>Pour the egg mixture.</li><li>Bake, pre-reducing the temperature to 200  C/392F  for 20 minutes. Remove, pour in the filling of blueberries, and bake the next 5-7 minutes.</li><li>Leave to cool.</li><li>On cooled pie arrange the remaining half of fresh blueberries.</li><li>Lightly sprinkle with granulated sugar and sliced almonds</li></ol>"
"Flawless Chocolate Fudge","antipasti","16","butter,evaporated milk,kosher salt,marshmallow fluff,semisweet chocolate chips,sugar,vanilla extract","<ol><li>Combine first five ingredients, stirring over low heat until blended.</li><li>Bring to a boil over moderate heat being careful not to mistake air bubbles for boiling. (VERY IMPORTANT)</li><li>Boil slowly, stirring constantly for a full 5 minutes. (Also very important!).</li><li>Remove from heat and stir in vanilla and chocolate until chocolate is melted. Stir in nuts if needed.</li><li>Turn into a 9 x 9 inch pan that has been sprayed with butter flavored cooking spray and cool completely.</li></ol>"
"Buttered Plantain Fries and Seasoned Avocado","side dish","3","avocado,butter,chili pepper,garlic,onions,plantain,salt,vegetable oil","<p>Peel and Slice your plantain into thin stripes and set aside.In a pan, pour in your butter and oil and heat slowly.Toss in your plantain and allow to brown on all sides.Mash your avocado, season with salt and stir in your chopped pepper, garlic and onion.Serve as a starter.</p>"
"Crispy Buttermilk Fried Chicken","lunch","6","chicken,flour,salt,paprika,pepper,buttermilk,vegetable oil","Mix flour, salt, paprika and pepper. Dip chicken in buttermilk and then into flour mixture. Cook chicken in oil, starting on medium-high heat, then, when chicken is browned, reduce heat to medium and cook an additional 30 to 35 minutes until chicken is done (approx 150-155 degrees F internal), turning occasionally."
"Black Bean and Veggie Burgers with Corn Salsa","side dish","8","canned black beans,canned corn,carrot,celery,creole seasoning,flour,fresh parsley,garlic,garlic cloves,green onions,ground pepper,ground pepper,ground pepper,jalapeno pepper,juice of lime,oatmeal,onion,panko breadcrumbs,red bell pepper,salsa,salt,salt,tomatoes","<ol><li>Mix all the salsa ingredients together (canned corn, jalapeño pepper, tomatoes, green onions, 1-2 cloves garlic, fresh parsley, juice of 1 lime, 1 tsp salt, 1 tsp pepper, 1 tsp ground red pepper) and chill for about an hour before serving.</li><li>Preheat your oven to 425 degrees F. Spray two baking sheets lightly with the nonstick spray and set aside.</li><li>Add the carrot to a bowl with a little water, cover it and microwave for about two minutes. Once cooled, mash them and add them to the mashed black beans. Mix together then add the remaining vegetables and mix well.</li><li>Add the oatmeal, breadcrumbs, seasoning and salsa. Mix together until combined. Add the flour and mix well. If the mixture is too moist, add more flour and adjust the seasoning, as needed.</li><li>Form the mixture into patties and place them on the baking sheets. Bake for about 20 minutes, flipping them halfway through cooking. When the burgers are finished, serve with the Corn Salsa or your favorite topping.</li></ol>"
"(Houston's) Spinach Dip","condiment","8","artichoke hearts,chicken stock,flour,frozen spinach,garlic,heavy cream,hot sauce,lemon juice,onion,pecorino romano cheese,salt,sour cream,unsalted butter,white cheddar cheese","<ol><li>Strain spinach and squeeze through a cheesecloth to remove as much liquid as possible.</li><li>In heavy saucepan over medium heat, saute garlic and onions in butter until golden, about 3-5 minutes. Stir in flour and cook for 1 minute.</li><li>Slowly whisk in cream and stock and continue cooking until boiling.</li><li>Once boiling, stir in lemon juice, hot sauce, salt and Romano cheese; stir until cheese has melted.</li><li>Remove from heat and allow to cool for 5 minutes.</li><li>Stir in sour cream, then fold in dry spinach and artichoke hearts.</li><li>Pour in large ovenproof/microwave proof dish. Or smaller ramekins (as shown.) Sprinkle cheddar evenly on top.</li><li>Heat in microwave or bake in oven until cheese on top is melted.</li><li>Serve hot with tortilla chips, sour cream and salsa for dipping.</li></ol>"
"Hot Cocaccino","side dish","2","hot cocoa mix,milk,half and half,instant espresso,marshmallows,chocolate syrup,whipped cream,sprinkles","Heat milk and half and half in medium saucepan until very hot; remove from heat.  Add hot cocoa mix and instant coffee.  Stir well and pour into mugs or cups.\nTop with mini marshmallows, then drizzle chocolate syrup over marshmallows.  Top with whipped topping and spinkles/cocoa powder."
"Brown Butter Twice Baked Sweet Potatoes","lunch","4","avocados,buttermilk,cooked bacon,fresh parsley,goat's cheese,salt and pepper,sour cream,sweet potatoes,unsalted butter","<p>Preheat your oven to 400 degrees F. Poke your sweet potatoes with a fork and place them directly on the rack of your oven. Place a piece of foil on the rack below to reduce mess. Bake the sweet potatoes for 45-50 minutes or until tender. Times may vary depending on how hot your oven gets.Remove the potatoes from the oven and let stand at room temperature until they are cool enough to handle, about 20-30 minutes. Leave the oven on.While your potatoes are cooling, melt the butter over medium heat. Continue to cook the butter, stirring frequently, until brown bits begin to form on the bottom of the pan, about 5-6 minutes. Pay close attention as the butter can quickly go from brown to burnt in a matter of seconds. Once you see the brown bits forming and a nutty aroma fills the air, pull the butter from the heat immediately. Set aside.Cut the tops off of the sweet potatoes, lengthwise. Scoop the sweet potato flesh into a medium bowl, leaving the skins in tact. To the bowl, add the brown butter, 2 tablespoons of the fresh parsley, 3/4 of the chopped bacon, and 4 ounces of the goats cheese. Sprinkle with salt and black pepper to taste and mash the ingredients together until combined. Scoop the filling back into the sweet potatoes.Place the potatoes on a baking sheet that has been lined with foil or parchment paper. Place them back in the oven to bake for 25 minutes.While your potatoes are baking for a second time, prepare your avocado cream. In the bowl of your food processor or blender, combine the avocados, sour cream and buttermilk. Add a dash of salt and pepper and pulse until completely smooth and creamy.Once your potatoes have baked, remove from oven. Sprinkle on the remaining parsley, bacon and goats cheese. Drizzle with avocado cream and serve immediately.Enjoy!I hope you enjoy this recipe for brown butter twice baked sweet potatoes!</p>"
"Slow Cooked Corned Beef and Cabbage","lunch","10","bay leaves,beef broth,black peppercorns,carrots,cider vinegar,corned beef brisket,garlic cloves,green cabbage,onions,potatoes,thyme","<ol><li>Stir the broth and vinegar into a 6-quart slow cooker. Add the onions, potatoes, carrots, beef and cabbage. Submerge the Bouquet Garni (last four ingredients) in the broth mixture.</li><li>Cover and cook on LOW for 8 to 9 hours or until the beef is fork-tender. Remove the Bouquet Garni.</li></ol>"
"Sweet & Spicy White Cheddar Cheese Ball W/apples & Bacon","antipasti","24","apple,brandy,maple syrup,bacon,lowfat cream cheese,extra sharp cheddar cheese,cayenne pepper,dark brown sugar,pecans","Put apple slices in small dish and sprinkle with brandy and maple syrup while you prep the rest of the recipe. Fry bacon in large skillet, turning frequently, until crisp, then set aside on a paper towel lined plate.\nFinely chop apples.\nCombine cream cheese, Adams Reserve New York Extra Sharp Cheddar, cayenne pepper, and apples in food processor. Pulse until mixture is throughly mixed and combined.\nCombine pecans, brown sugar, and cooled, crumbled bacon in mini-food processor (or wash out regular processor and dry) until finely chopped.\nUse spatula to remove cheese mixture to a cutting board. Lightly wet hands and roll the cheese into a ball. Roll in the bacon pecan mixture and pat to coat.\nArrange on serving platter with crackers and apple slices dipped in lemon juice/water. Enjoy!"
"Fast Tiramisu","","12","egg yolks,cane sugar,mascarpone cheese,heavy whipping cream,ladyfingers,coffee liqueur,coffee,unsweetened cocoa powder,vanilla sugar","First thing: make the coffee and let it cool down, THEN add the rum!\nSecond, beat the whipping cream, and put it in the fridge (do not add sugar in it, just vanilla sugar, if you have one envelope in the house)\nBeat the egg yolks with the sugar (6 tbsp sugar) until become thick and lemon colored.\nThen add mascarpone cheese, beat until incorporated, and vanilla bean or vanilla sugar.\nAt the end add whipping cream, beat until incorporated.\nIn a pan (26cm / 40cm) line up the lady fingers, after you soaked Them one by one into the coffee (just 1 second each side). Add half of the cream, THEN line up the other half of lady fingers (same soaked in coffee) but in the opposite way.\nOn the top you put the rest of the cream and garnish with cocoa.\nPut it in the fridge for at Least 6 hours!\nGood luck!\nNo baking, just 30 minutes and Tiramisu is ready!"
"Best Baked Macaroni and Cheese","lunch","12","black pepper,cayenne pepper,elbow macaroni,flour,gruyere,kosher salt,nutmeg,unsalted butter,white bread,white cheddar cheese,whole milk","<ol><li>Heat the oven to 375 degrees. Butter a 3-quart casserole dish; set aside. Place bread pieces in a medium bowl. In a small saucepan over medium heat, melt 2 tablespoons butter. Pour butter into the bowl with bread, and toss. Set the breadcrumbs aside. In a medium saucepan set over medium heat, heat milk. Melt remaining 6 tablespoons butter in a high-sided skillet over medium heat. When butter bubbles, add flour. Cook, stirring, 1 minute.</li><li>Slowly pour hot milk into flour-butter mixture while whisking. Continue cooking, whisking constantly, until the mixture bubbles and becomes thick.</li><li>Remove the pan from the heat. Stir in salt, nutmeg, black pepper, cayenne pepper, 3 cups cheddar, and 1 1/2 cups Gruyere. Set cheese sauce aside.</li><li>Fill a large saucepan with water. Bring to a boil. Add macaroni; cook 2 to 3 fewer minutes than manufacturers directions, until outside of pasta is cooked and inside is underdone. (Different brands of macaroni cook at different rates; be sure to read the instructions.) Transfer the macaroni to a colander, rinse under cold running water, and drain well. Stir macaroni into the reserved cheese sauce.</li><li>Pour the mixture into the prepared casserole dish. Sprinkle remaining 1 1/2 cups cheddar and 1/2 cup Gruyere; scatter breadcrumbs over the top. Bake until browned on top, about 30 minutes. Transfer dish to a wire rack to cool for 5 minutes; serve.</li></ol>"
"Holiday Egg Nog","side dish","4","allspice,cinnamon,egg yolks,heavy cream,milk,nutmeg,sugar","<ol><li>Add the egg yolks and sugar to your mixer. Whip it up good until the mixture turns a light yellow color.</li><li>Now, grab your small saucepan and add to it the milk, heavy cream, allspice, nutmeg, and cinnamon.</li><li>Heat it up to just boiling and remove it from the heat. Grab about a half a cup of the hot milk and add it into the egg mixture, whisking constantly. Now add the tempered egg mixture back into the rest of your milk mixture, continuing to whisk constantly.</li><li>Put the mixture back on medium low heat and cook it until just boiling and thickened.</li><li>Pop it into a container and set it in the fridge to cool completely.</li></ol>"
"Caprese Quick Bread","morning meal","12","flour,white whole wheat flour,baking powder,salt,dried basil,mozzarella cheese,olive oil,whole egg,non-fat milk,sundried tomatoes,butter","Heat oven to 350. Spray a 9x5x3 loaf pan or two mini bread pans with cooking spray.\nStir together flours,cheese, baking powder, basil and salt in medium bowl. Add olive oil, egg and milk, stir till combined. Fold in sundried tomatoes.\nPour into pan, drizzle melted butter over top of bread. (Bread will be thick, flatten it out with your fingers)\nBake 30 minutes for mini loaf pans and 40  50 minutes for large loaf pan, or until golden brown and toothpick inserted in center comes out clean. Cool 5 minutes, remove from pan to wire rack. Cool 30 minutes before slicing, if you can control yourself!"
