"5 Minute Xocai Chocolate Mug Cake","side dish","2","dark chocolate,eggs,flour,honey,milk,vanilla","<ol><li>Add egg, milk, oil, honey, and vanilla into a coffee mug. Mix together wit a fork. add the flour, Activ, and Sipping Xocolate. Mix again. Put mug in the microwave and cook for 3 minutes at high power. the cake will rise slightly over the top of the mug. Allow to cool a little. Tip out onto a plate if desired. Eat while warm. Serves 2</li></ol>"
"Crawfish Cake Sliders","fingerfood","8","oil,crawfish tails,red onion,garlic,creole spice,egg,bread crumbs,slider buns,tartar sauce","In a saute pan heat 1 teaspoon oil, add chopped onion, red pepper and celery and cook until tender, about 2-3 minutes.\nRemove pan from heat and add garlic, crawfish meat, and 1 teaspoon Creole spice (or to taste). Transfer to a mixing bowl and set aside to cool.\nMix in egg and enough bread crumbs for mixture to bind; adjust seasonings to taste with salt, pepper and Creole spice.\nForm into 8 equal patties and flatten to 3/4-inch thick. Heat remaining oil in a saute pan and cook cakes on both sides until brown and crispy.\nServe with a dollop of tartar sauce."
"10 Minute Brownies","antipasti","16","baking powder,canola oil,chopped walnuts,semisweet chocolate chips,sugar,unbleached flour,unsweetened applesauce,vanilla extract","<ol><li>Preheat oven to 350 degrees F. Lightly oil a 6 x 9 inch baking pan and set aside.</li><li>In a small saucepan over low heat, combine the oil and chocolate chips, stirring occasionally until melted. Remove from heat and set aside.</li><li>To a large bowl, add the applesauce, sugar and vanilla. Blend well. Stir in the chocolate mixture. Whip and blend well. Add the flour, baking powder and walnuts, and mix just to combine. Spoon the batter into the baking pan. Bake for 25 to 30 minutes or until the top springs back when lightly touched. Be careful not to overbake the brownies or they will be dry. Let cool completely before cutting into squares. Store in a covered, airtight container in the refrigerator.</li></ol>"
"Peppermint Brookie Pies - gluten free, dairy free","antipasti","16","aluminum free baking powder,bittersweet chocolate,candy canes,cane sugar,cane sugar,cocoa powder,egg whites,eggs,flavor shot,kosher salt,palm oil,rice flour,semi-sweet chocolate,sorghum flour,tapioca starch,vanilla paste,water,ground espresso","<ol><li>Preheat oven to 375 F.</li><li>For the pies:</li><li>Fill a medium saucepan (relatively the same size as the bowl) about 1/3 full with water and set over medium heat.</li><li>In a medium glass bowl, combine the bittersweet chocolate, semi-sweet chocolate and shortening.</li><li>When the water simmers, place the bowl of chocolate and shortening over the simmering water and lower the heat. Make sure your bowl does not touch the simmering water. The more you stir the shinier your cookies will be.</li><li>When the chocolate and shortening has melted, remove the bowl from the heat; stir to assure it's completely mixed. Set aside to cool a few minutes.</li><li>Meanwhile, in another bowl, whisk together the sugar, eggs, vanilla paste, and espresso. Set aside.</li><li>In another bowl, sift together the flour, cocoa powder, baking powder and salt. Set aside.</li><li>Whisk the melted chocolate into the sugar/egg mixture.</li><li>Add the flour mixture, whisk. Only whisk until blended, over-mixing can affect the texture of the pies.</li><li>Line 2 baking sheets with parchment paper, no need to grease the paper.</li><li>Drop a heaping tablespoon of batter (keeping the shapes as round as possible) onto the baking sheets. You are aiming for rounds that are about 2 inches in diameter. Take care to leave some room (about 2 inches) between each one to allow for spreading that will occur as they bake.</li><li>Bake for 6 to 8 minutes.</li><li>Leave in the oven an additional minute if they seem under baked. The cookie will have a brownie like crackling surface, and will feel soft, when ready.</li><li>Allow them to cool for about 10 minutes before gently lifting them off the baking sheet and onto a flat surface for piping the filling.</li><li>For the Filling:</li><li>Combine 1 1/4 cups sugar and the water in a small saucepan.</li><li>Heat over medium heat with a candy thermometer attached to the inside of the saucepan, and stir to dissolve. </li><li>When the mixture reaches 220 degrees F it is ready for the stand mixer.</li><li>Meanwhile, in a bowl of a stand mixer fitted with the whisk attachment, whisk the eggs on medium speed until it begins to look very foamy(about 3 minutes).</li><li>Avoiding the whisk, gradually add the remaining 2 tablespoons PLUS 1 teaspoon sugar. </li><li>Increase the speed to high and whip until soft white peaks are formed.</li><li>At this point check to see if your sugar has cooled. If it has cooled, turn heat back on to high until it comes back up to 220 degrees F just before adding to stand mixer.</li><li>When egg whites are at a soft peak stage resembling marshmallow fluff,slowly add the hot sugaralong the edge of the mixer avoiding the whisk.</li><li>Continue to whisk on high until the bowl has cooled, about 5 minutes.</li><li>Add peppermint extract, whisk another 30 seconds.</li><li>Refrigerate for 5 minutes before transferring to a piping bag with a plain tip attached or a large ziploc bag with one corner cut a 1/4 inch.</li><li>For Garnish:</li><li>Place candy canes between layers of wax paper, then sandwich between a dish towel.</li><li>Using a meat tenderizer, or the back of a dry measuring cup, pound the candy cane until broken up into very small pieces.</li><li>Make sure the candy cane is between wax paper first, otherwise, the candy cane will stick to the dish towel.</li><li>Assemble:</li><li>Turn the brookie cookies upside down, pipe about 2 tablespoons of filling onto half of the cookies.</li><li>Cover each filled cookie with a dry cookie, press down just enough so that filling adheres to the cookie.</li><li>Sprinkle crushed candy cane around the brookie pie edges.</li><li>Serve chilled or at room temperature.</li></ol>"
"Prosciutto Wrapped Broccolini With Basil Crisps","","4","broccolini,fresh basil,meat,balsamic vinegar,olive oil,salt and pepper","Prepare an ice bath. Trim the bottom tip off the broccolini. Bring a large pot of water to a rolling boil. Add a generous amount of salt. Blanch the broccolini for 30 seconds, remove, then submerge into the ice bath. When the broccolini is fully cooled, drain and pat dry with a kitchen towel.\nReduce the balsamic vinegar over medium heat until it becomes 1/4 cup of sticky syrup. Set aside.\nDrop a small handful of basil leaves into the oil. Shield yourself from potential splatter. It only takes one second for the leaves to pop. Immediately fish them from the oil with a strainer and place onto a towel-lined plate. The leaves should become crisp and translucent, but not darkened or it will be bitter.\nHeat up the grill and coat generously with olive oil. Grill the broccolini until slightly charred and softened. Season with salt and pepper.\nWrap the broccolini with prosciutto. Place onto serving platter, drizzle with some extra virgin olive oil and the balsamic reduction.\nGarnish with basil crisps when ready to serve."
"Eggplant & Artichoke Heart Galettes","lunch","2","artichoke hearts,brown rice flour,chili flakes,eggplant,eggs,fresh rosemary,garlic cloves,goat cheese,bell pepper,sea salt","<ol><li>Peel and thinly slice the eggplant. Place in a drainer or bowl and toss with sea salt. Let it sit for one hour for the bitter juices to be drawn out. Rinse under running water to remove the salt and squeeze tightly with your hands to remove excess water. Place in a mixing bowl.</li><li>In a medium bowl, beat eggs with flour to make a thick paste. If paste is thin, add extra flour. Mix well till the mixture is smooth. Stir in eggplant &amp; artichoke hearts and mix till they are well coated.</li><li>Add rosemary, chili flakes, garlic and season to taste with sea salt and pepper (be careful not to add too much salt) . Add goat cheese and mix carefully so not to cream it - you want them to be chunky.</li><li>Heat a large oiled pan. When hot, pour about 2 spoonfuls of mixture into the pan and they should form into galettes or "cakes". Cook until both sides are golden brown.</li><li>Makes 6 galettes/cakes. Serving size is 3 cakes per person.</li></ol>"
"Cider-Braised Pork Shoulder With Caramelized Onion and Apple Confit","lunch","4","pork shoulder,salt and pepper,olive oil,yellow onions,brandy,granny smith apple,garlic cloves,fresh thyme,apple cider,chicken stock,dijon mustard","Preheat oven to 400 F.\nPat the pork dry and season with salt and pepper.\nHeat oil in a large ovenproof pot or Dutch oven with a lid.\nBrown pork on all sides, turning with tongs, 6-8 minutes per side.\nTransfer pork to a plate.\nPour off excess fat from pot.\nAdd onion and 1 teaspoon salt.\nSaut over medium heat, stirring occasionally, until the onions are very soft and deep golden brown, 18-20 minutes.\nAdd Calvados and stir to deglaze pan.\nAdd apple, garlic and thyme and cook, stirring, 30 seconds.\nReturn pork to pot, nestling it down in the onions.\nAdd cider and chicken stock.\nCover pot and place in oven.\nReduce heat to 325 F.\nBraise until meat is very tender, 2 1/2 - 3 hours.\nTransfer pork to a cutting board and remove kitchen strings.\nBoil onion and apples until thickened and liquid slightly reduced, about 2 minutes.\nStir in mustard.\nSeason to taste with salt and pepper.\nCut pork into serving pieces and arrange on platter or individual serving plates.\nSpoon onion and apple confit over and around the meat."
"S'more Bars","dessert","8","butter,sugar,graham cracker crumbs,milk chocolate chips,marshmallows","Heat oven to 350F. Grease 8-inch square baking pan.\nMix graham cracker crumbs, melted butter, and sugar until mixed. Press half of dough in prepared pan.\nSprinkle  chocolate chips over graham cracker layer. Sprinkle with mini marshmallows; scatter bits of remaining graham cracker crust over marshmallows. Bake 15 to 17 minutes or just until lightly browned. Cool completely in pan on wire rack. Cut into bars. 16 bars."
"Salsa Verde Chicken Tamales","","48","roasted chicken,chicken,garlic,onion,cumin,sea salt,olive oil,water,salsa verde,tomatillos,chile,chile,chiles,yellow onion,cilantro,sea salt,filo dough,masa flour,masa flour,sea salt,palm oil,chicken broth,salsa verde","Roasted Chicken\n1. Place your chicken into a roasting pan or dutch oven. I left the organs and the neck for added flavor.\n2. Put garlic cloves under the skin of the chicken\n3. Chop the onion and scatter around the bottom of the pan. Pour in water.\nSalsa Verde\n1. Remove the hulls from the tomatillos. They will be sticky, don't worry if you can't wash it all off. Remove the stems.\n2. Place all the tomatillos and chiles into a sauce pot. Cover with water and boil until soft.\n3. Remove the tomatillos and chiles from the water and place in a blender. Add all the remaining ingredients and blend until smooth.\n4. It's as simple as that. A yummy salsa perfect for tamales, eating with chip or putting on top of whatever you're eating!\nTamale Dough (Masa)\nMix all together to make a soft, sticky dough.\nSalsa Verde Tamales\nTamale Dough\nShreded chicken\n2 cups Salsa Verde\n10 to 40 green olives\n4 medium potatoes\n1. Remove the corn husks from the bag and place them in a pot of hot water. Continue to heat on low for   at least 30 minutes. You want them to be pliable.\n2. Add your shreded chicken to a skillet and cover with  about two cups of salsa verde.\n3. If you have large olives you will want to cut them in 1/2 or in 1/4. If they are small you might just want to leave them whole. I prefer to remove the pit but you don't have too, just watch out when you bit into the tamale. Place in small bowl and set aside.\n4. Cut the potatoes into small, thick strips. You don't have to remove the peel.  I used red potatoes because that is all I had. Normally I would use  regular old potatoes. Place in a small bowl, cover with water  to previent them from turning brown and set aside.\n5. Now comes the fun part! Asembling the tamales! It is best to do this with a firend. My sister helped me since I am visiting her right now. Remove the soaked corn husks from the pot.\n6. Pick out the husk you want to use. Normally one big one is enough. If the are small you may have to use two, overlapping a bit.\n7. Spred about 2TBS of the dough across the bottom half of the husk, narrow end pointing away from you about 1/8 in thick. Going a little more than half way up, leaving a tiny bit of room on the sides.\n8. Now place a small amount of chicken in the middle of the dough. I can't remember the exact amount I used.\n9. Place a potatoe sclice in the middle of the chicken and an olive at the end.\n10. Fold in one side and then the other. Fold up the bottom. If you want you can tie them closed with a small strip of husk. I don't.\n11. In a large pot pour in a about two cups of water. Place as many tamales that will fit in the pot, open end facing up. Place the lid on the pot and bring to a boil. Once boiling, turn down the heat and steam for 30 to 45 minutes.\n12. Remove from the pot and enjoy!! You will know that they are done when the husk can be pulled away from the masa and not stick. I served mine with refried beans and rice. The rice recipe will soon to follow, hopefully! This recipe made almost 4 dozen tamales. They can be frozen to save for later. Simply let them defrost and steam until warm."
"Bittersweet Chocolate Ice Cream","side dish","2","half n half,heavy whipping cream,instant coffee,vanilla extract","<ol><li>Prep your ice cream maker according to the manufacturers directions.</li><li>In a medium sauce pan, heat the half & half until warm- not hot.</li><li>In a bowl, whisk the egg yolks until blended.</li><li>Add the sugar and about 1/2 of the warm half and half. Stir to combine well and add the mixture back to the saucepan. Whisking briskly while combining.</li><li>Cook over medium heat until the mixture coats the back of a silicone spatula (about 10-12 minutes). Remove from heat and add the chocolate and coffee, stir to melt and combine thoroughly.</li><li>Place the pan with the custard in an ice bath to cool, stirring occasionally, until it reaches room temperature.Add the whipping cream and vanilla</li><li>Pour into another container and chill until cold -several hours-or you are ready pour into the ice cream maker.</li><li>Freeze in the ice cream maker according to the manufacturers directions. Makes about a quart.</li></ol>"
"Egg and Dairy Free Pancakes","morning meal","12","flour,whole wheat flour,sugar,baking powder,baking soda,salt,ground flaxseed,almond milk,cooking oil","In a small bowl, mix together ground flaxseed with 3 tbsp water. Let stand for 2-3 minutes before using.\nIn another bowl, mix together flours, sugar, baking powder, baking soda and salt. Add almond milk and cooking oil to flaxseed, then pour into the flour. Mix well until there are few lumps left.\nHeat a skillet over medium heat. Add 1/4 c.of batter to the pan. Cook for 2-3 minutes until bubbles form on top. Flip and cook for 2 minutes on the other side. Remove from pan and repeat until batter has been used up.\nServe with maple syrup or your favorite jam."
"Avocado-Mango Salad With Grilled Shrimp","side dish","4","shrimp,hass avocados,mango,lime wedges,mango,red wine vinegar,lime juice,fresh ginger,sugar,dijon mustard,canola oil,cilantro,lime zest,habanero chile,red onion,salt and pepper","Preheat gas grill to high.\nMake the dressing: Combine all dressing ingredients (except oil) in a blender and blend until smooth. While blender is running, remove lid and pour in oil in a steady stream. Continue blending for several seconds, then remove and set aside.\nPrepare the shrimp: Rinse shrimp and pat dry with a papertowel. Add about 1/3 cup of dressing and toss to coat. Let sit for 15 to 20 minutes. String onto wooden or metal skewars for grilling. Grill over high heat for about 2 to 3 minutes per side. Remove from grill, let cool, them remove from skewars.\nIn a large bowl, combine mango, avocado and grilled shrimp. Add dressing to taste; toss lightly and serve."
"Buffalo Ranch Chicken Dip","condiment","7","chicken breasts,cream cheese,green onions,hot sauce,poultry seasoning,ranch dressing,sharp cheddar cheese","Take your chicken breasts and give them a light coat of the Poultry Magic seasoning, and then coat them with Pam cooking spray. (The Pam keeps the chicken from drying out while cooking.) Grill your chicken breasts and then allow to cool slightly.Preheat your oven to 350 degrees. Shred your chicken and then combine in a 13 x 9 inch glass baking dish with your Louisiana Hot Sauce. Place your cream cheese and dressing into a sauce pan over medium heat until the texture is smooth. Pour this mixture over your chicken and hot sauce mixture in the dish. Top with cheddar cheese and green onions.Bake un-covered for 30 minutes until bubbly. Let stand until slightly cooled, and then serve with tortilla chips of our choice!"
"Turkey and Rice Stuffed Acorn Squash","side dish","6","olive oil,acorn squash,brown rice,onion,garlic,lean ground turkey,baby bella mushrooms,spinach,vegeta seasoning,bell pepper,salt and pepper,whole wheat bread crumbs","Prepare rice according to package instructions. (I either cook the rice in chicken stock, or this time I used water and added 1 tablespoon vegeta seasoning to the water to add flavor to the rice as it cooks.)\nMeanwhile preheat oven to 375 degrees. Cut squash in half and drizzle with olive oil, salt and pepper. Roast skin side down for 30 minutes.\nHeat 1 tablespoon olive oil in large skilled. Add diced onions. Cook until translucent. Add garlic and cook for 1 minute longer. Add turkey, 1 tablespoon vegeta, red pepper, salt and pepper. Cook until turkey is browned and almost cooked through. Rough chop the mushrooms and add to the pan. Cook until mushrooms are softened. Add rice and spinach and stir until spinach is just wilted.\nStuff the squash with the meat and rice mixture and top with bread crumbs. (Either toss bread crumbs with 2 teaspoons olive oil, or I just spray them with spray olive oil to make sure that they brown in the oven.\nBake stuffed squash in oven until bread crumbs are browned."
"Chilled Cucumber Avocado Soup with Yogurt and Kefir","soup","3","avocado,cucumbers,grapes,juice of lemon,kefir,plain greek yogurt,red onion,salt and pepper,scallions",""
"Cinnamon Twists","side dish","14","active yeast,butter,eggs,milk,salt,sugar","<ol><li>Combine 2 cups flour with yeast.</li><li>Heat and stir milk, butter or margarine, sugar and salt until warm and butter is almost completely melted.</li><li>Add this  to the flour mixture along with the eggs.</li><li>Beat with an electric mixer on low speed for 30 seconds, scraping the bowl, then beat on high speed for approx. 3 minutes. Stir in as much of the remaining flour ( 2 to 2 1/3 cups) as you can.</li><li>Turn out onto a lightly floured surface. Knead in enough remaining flour to make a moderately soft dough that is smooth and elastic (about 3 - 5 minutes). Shape into a ball. Place in a lightly greased bowl. Cover and let rise in a warm place till double in size. (About 1 hour)</li><li>Punch dough down. Divide in half. Cover and let rest 10 minutes.</li><li>Roll half of the dough into a 12x8 inch rectangle. Melt 3 tablespoons butter or margarine; brush half over the dough. combine 3/4 cup sugar and 2 1/2 teaspoons ground cinnamon; sprinkle half of the mixture over dough. Fold dough in half and then in half once more. Cut strips of dough along the short end and twist sealing the seams.</li><li>Place in a baking sheet. Cover; let rise till nearly double about 30 minutes.</li><li>Bake in a 375 degree oven for 20 to 25 minutes. (Be sure to check them, they brown easily.)</li><li>For the sugar glaze combine 1 cup sifted powdered sugar with 1/4 teaspoon vanilla and 1 tablespoon milk. Continue to add milk 1 teaspoon at a time until you get a drizzling consistency.</li></ol>"
"Maple Glazed Bacon Wrapped Pork Tenderloin","","4","lean pork tenderloins,kosher salt,ground pepper,bacon,maple syrup,toothpicks","Sprinkle tenderloins with salt and pepper.  Place in a bowl or shallow dish.  Cover, and refrigerate for 30 minutes.\nMeanwhile soak toothpicks in water and prepare a gas or charcoal grill for medium-high, indirect grilling (variation: soak some applewood chips to add just before cooking)\nWrap bacon slices around pork, securing with toothpicks.  Place on grill and brown for a few minutes, covered.  Baste with some maple syrup and continue to grill for about 20-25 minutes, turning and basting occasionally with the maple syrup.\nThe pork should be done in 20-25 minutes total, or until the internal temperature reaches about 150 and the bacon is uniformly crispy.\nRemove from grill and let sit at room temperature for about 5 minutes before slicing.  Serve with accumulated juices!"
"Tzadziki","side dish","2","cucumbers,sea salt,yogurt,sour cream,olive oil,vinegar,garlic,white pepper,fresh dill","Salt lightly the cucumbers, mix and set aside for 5 minutes to release the water. To remove as much water as possible from the grated cucumber, squeeze it in small quantities with hands.\nMix and combine yogurt, sour cream, olive oil, vinegar, garlic and white pepper until smooth.\nAdd cucumbers and dill, mix and combine.Adjust the seasoning.\nChill for at least two hours before serving."
"Instant Pot Chicken Tacos","lunch","6","black pepper,chicken breasts,lime juice,purple onion,salsa,taco seasoning","Season both sides of the chicken with pepper and taco seasoning.\nPlace chicken into the bottom of the Instant Pot.\nTop chicken with onion and salsa.\nSecure Instant Pot lid into the lock position.\nPlace the lid onto the Instant Pot and turn on the Poultry setting. Set for 12 minutes.\nOnce finished, allow the Instant Pot to naturally release pressure for 20 minutes.\nRemove chicken from the Instant Pot and shred. Sprinkle with lime juice.\nServe over rice or with tortillas for some amazingly easy and delicious tacos."
"Tropical Ice Pops","side dish","6","coconut milk beverage,light coconut milk,mango,maple syrup,pineapple,popsicle moulds","<ol><li>Pure the mango, pineapple, 3/4 cup coconut beverage and 1 1/2 tablespoon maple syrup in a blender.</li><li>Pour equal amounts of the mixture into each mould.</li><li>In a small bowl, mix the coconut milk, 1/4 cup of coconut beverage, and 2-3 TBS of maple syrup (adjust the sweetness to your taste).</li><li>Pour equal amounts of the coconut mixture on top of the fruit pure.</li><li>Insert a popsicle stick into each of the moulds, leaving about a quarter of the stick above the mould.</li><li>Freeze the popsicles for about 2 to 3 hours.</li><li>To remove the ice pops from the moulds, run them under warm to hot water for about 5 to 10 seconds before pulling them out.</li></ol>"
"Green Beans with Garlic Chips","side dish","4","apple cider vinegar,garlic cloves,green beans,olive oil,salt and pepper,unsalted butter,white balsamic vinegar,yellow onion","<ol><li>Heat the oil with the garlic in a heavy skillet over medium heat. Cook stirring occasionally, until the garlic is golden. Remove the garlic from the skillet with a slotted spoon and transfer to a paper towel.</li><li>Add the butter to the oil in the skillet and heat over medium heat. Add the onions, salt and pepper and saut, until the onions are translucent and starting to turn golden.</li><li>Add the beans and continue cooking stirring occasionally. Stir in both vinegars and season with salt and pepper to taste.</li><li>Transfer the beans to a serving dish and sprinkle with the garlic chips.</li></ol>"
"Easter Bunny's Vegan Ambrosia Salad","side dish","4","heavy cream,sugar,vegan sour cream,marshmallows,orange segments,pineapple,coconut,pecans,maraschino cherries","Place the cream and sugar into the bowl of a stand mixer with the whisk attachment and whip until stiff peaks are formed. Add the sour cream and whisk to combine. Add the marshmallows, orange, pineapple, coconut, pecans and cherries and stir to combine. Transfer to a glass serving bowl, cover and place in the refrigerator for 2 hours before serving."
"Charred Onion Dip w. Steamed Red Potatoes for Dipping","condiment","6","fresh chives,lemon juice,mayonnaise,olive oil,onion,plain greek yogurt,scallions,sea salt,shallot,sour cream",""
"Raised Doughnuts","antipasti","24","egg,flour,milk,oil,powdered sugar,salt,shortening,sugar,vanilla,water,water,yeast","<ol><li>Dissolve yeast by letting stand 5 minutes in warm water without stirring. In a bowl mix the milk, sugar and salt. Add the dissolved yeast. Then stir in egg and shortening.</li><li>Gradually add flour. As dough becomes stiffer, use hands. Knead until smooth and elastic. Put into lightly greased bowl and cover with a damp cloth. Let rise 2 hours. Punch down and let rise for 1 hour. Roll to 1/3 inch thickness. Cut and let rise 30 to 45 minutes. Leave uncovered so crust will form on top. Slip top side down into fat at 375 degrees. Turn and do not pick with fork. Cook approximately 3 minutes.</li><li>Dip in topping and let cool or shake in a brown paper bag with some powdered sugar.</li></ol>"
