"Vegan Taco bowls with Cilantro Lime Cauliflower Rice","side dish","4","avocado oil,cauliflower,chili powder,fresh cilantro,garlic powder,hass avocado,jalapeno,lime juice,onion,salt,tomato,walnuts","<ol><li>Set the nuts to soak in a bowl of water 2-8 hours before preparing the meat.</li><li>Preheat the oven to 375 F and line a baking sheet with aluminum foil.</li><li>Finely chop the cauliflower into rice-sized pieces, or pulse in the food processor until the desired consistency. Toss with the oil and spread onto the baking sheet in an even layer. Bake for 18 minutes, stirring halfway through.</li><li>While the cauliflower rice is cooking, prepare the guacamole and taco meat.</li><li>Cut the avocado into large chunks and place into a small bowl. Add the lime juice and mash the avocado to a chunky puree or your preferred consistency. Stir in the cilantro, jalapeno, onion and spices. Set aside.</li><li>Remove the nuts from the water and place into a small food processor. Discard the water. Pulse the nuts until theyve reached a ground meat consistency, I find about 5-7 pulses works. Transfer to a bowl and stir in the salt, cumin, garlic powder, and red chili powder. Set aside.</li><li>When the cauliflower is done, transfer to a mixing bowl while still warm and stir in the lime, cilantro, and salt.</li><li>To assemble the bowls, layer 1 cup of the cauliflower rice in a bowl with taco nut meat, a dollop of guacamole, fresh tomatoes, and a sprinkling of fresh cilantro.</li><li>Serve immediately with an additional slice of lime if desired.</li></ol>"
"Southern 7 Layer Salad in a Mason Jar","salad","8","bacon,black pepper,eggs,lettuce,mayo,peas,red bell pepper,sour cream,sugar,yellow onion","<ol><li>For dressing: in a small bowl mix together mayo, sour cream, sugar, and pepper. Chill until ready to serve.</li><li>Meanwhile cook bacon in a skillet until crisp. Remove to a paper towel lined plate to cool then dice into bite size pieces.</li><li>Dice eggs into bite size pieces with a knife or egg slicer.</li><li>To plate: I like to serve mine in large mason jars (21oz) for presentation as an entree. But can also be arranged in bowls or a large trifle dish. Add a couple spoonfuls of dressing in the bottom of the jar, top with chopped lettuce, onions, red bell pepper, peas, egg, and bacon. You can screw a lid on top of jar, shake, and then eat out of the jar or pour into a bowl and enjoy!</li></ol>"
"Brownie Cheesecake","side dish","12","cookie crumbs,cream cheese,eggs,granulated sugar,mix of brownies,salt,sugar,unsalted butter,vanilla","<ol><li>Mix the crumbs, sugar and butter together in a large mixing bowl, until the crumbs clump together when gathered in your fist</li><li>Pat the crumbs in an even layer in the bottom of an 8 x 3 inch springform pan</li><li>Place the pan in a 325 degree oven and bake for 10 minutes, until the crust is firm.</li><li>Allow the crust to cool completely on a rack.</li><li>Wrap the pan with the crust twice with heavy duty aluminum foil</li><li>Place the sugar, then the cream cheese, vanilla and salt in the large bowl of a stand mixer. Mix on low speed, until the cream cheese is completely smooth. BTW, I use Philadelphia Cream Cheese as I find it the smoothest.</li><li>Add the eggs, one at a time, mixing them in completely after each addition.</li><li>Pour one third of the cream cheese mixture into the prepared pan. Add a third of the browinies, then pour in another third of the cream cheese mixture. Repeat with anothe third of the brownies, then pour on the remianign cream cheese mixture. Stick the rest of the brownies into the top of the cheesckae, pushing them down into the mixture slightly.</li><li>Place the preapred and filled pan in a larger pan, then pour in enough hot water to come up to half of the pan's height.</li><li>Bake at 325 degrees for about 1 1/4 to 1/2 hours, or until it is mostly set. Turn of the oven, then leave the cheesecake in the oven,placing  a large wooden spoon in the oven door, so that it remains slightly open. Allow the cheeecake to cool in the open oven for about an hour, then cool completley on a rack. When it's cool, wrap it very well, and cool in the refrigerator for several hours.</li><li>To unmold the cake, wipe the sides and bottom of the pan with a hot, damp towel. Run a thin metal spatula around the edge of the pan. Release the spring, then lift the cake still on the on the removable bottom from the sides of the pan. Flip the cake gently onto a cardboard round or flat platter, remove the bottom, then flip it over onto another cardboard round or flat serving platter.</li></ol>"
"Homemade King Ranch Chicken Casserole","lunch","6","butter,cooked chicken breasts,cream of chicken soup,cream of mushroom soup,diced tomatoes with green chilis,flour tortillas,jack cheese,onion","If you haven't already, cook your chicken breasts by boiling them in water for 20 minutes, or until juices run clear when cut into. Then cube and set aside.Preheat the oven to 350. Chop the onion into small pieces and saute in  cup butter over medium heat for 5 minutes or until slightly translucent. Turn heat down to low and add both cans of soup, stirring until mixed well. Remove from heat and set aside.In a prepared 9 x 13 baking dish place a layer of tortillas to cover the bottom of the dish. Add a thin layer of tomatoes and green chilis, a thin layer of the soup mixture, a thin layer of chicken, and top with cheese. Add another thin layer of tortillas, tomatoes and green chilis, soup mixture, chicken, and cheese. Keep doing the layers until you run out of space, finally covering the dish with the remaining cheese.Bake in the preheated oven on 350 for 45 minutes, or until cheese is turned a golden brown. Allow to cool before serving."
"Vegetarian Chinese Pot Stickers","antipasti","24","won ton wrappers,mushrooms,soy sauce,sriracha hot sauce,fresh ginger,garlic,scallions,cornstarch,vegetable oil,water","Add all of the ingredients (except the wrappers, cornstarch, oil, and water) to the bowl of a food processor. Pulse until the mushrooms are finely minced and all of the ingredients are well combined. It will help if youve given the mushrooms a bit of a rough chop first, or if you use pre-sliced mushrooms.\nPlace a won ton wrapper on your work surface, turned so that it appears to be a diamond shape.\nPlace a teaspoon of filling in the middle of the wrapper.\nDip a fingertip into the bowl of water and trace along the two edges farthest from you. Bring up the end closest to you, fold over the filling, and pinch the edges together to seal. Make sure youve gently pressed the wrapper around the filling so there are no air pockets.\nStand up your little triangle pocket so that the filling side sits on your work surface. Fold the top point down, away from you, and pinch. Now, give the edges on either side of that fold 2 little pleats and pinch. Your pot sticker will now look like it has wings. Place it on a large plate thats been dusted with a bit of cornstarch, to prevent sticking.  (Traditionally, pot stickers are made with round dumpling wrappers, so if you have them, you can skip the part about folding the top point down.)\nHeat the skillet over medium-high heat. Brush just a few drops of oil onto the hot pan surface, and place 12 of the pot stickers, upright, into the pan. Allow the bottoms to brown. Carefully add 1/2 cup water to the pan and cover it quickly. Cook for about 3-4 minutes, or until all of the water has been absorbed. Remove the pot stickers immediately to another plate to keep warm, and repeat the procedure with the rest of the uncooked ones.\n*Feel like you have to have meat? Substitute 4 oz. of ground chicken (or pork, if you must) for half of the mushrooms, just dont run it through the food processor. Mix the processed ingredients with the ground chicken thoroughly and fill the wrappers as before. Add a full cup of water (instead of 1/2 cup) to the pan, and steam until the water evaporates, about 5-6 minutes."
"Tomato, Cucumber & Onion Salad with Feta Cheese: Real Convenience Food","salad","1","balsamic vinegar,extra virgin olive oil,feta cheese,grape tomatoes,persian cucumber,red onion,salt and pepper",""
"Drunken Apple Cake","","6","sugar,shortening,eggs,flour,baking soda,cinnamon,salt,tart apples,walnuts,bbq sauce,cornstarch,half n half,butter,whiskey,salt","Pre heat oven to 350\nSpray a 913 pan with baking spray\nCream shortening and sugar\nAdd eggs and mix\nAdd dry ingredients, mix well\nFold in apples and walnuts\nSpread in prepared baking pan\nBake for 35-40 minutes until a toothpick inserted near the center comes out clean.\nFor Sauce Mix sugar and cornstarch in small saucepan\nStir in half-and-half Bring to a boil and boil for 4 minutes\nRemove from heat and add butter, stirring until melted\nAdd Bouron and salt\nServe cake warm with warm sauce topping\nSubstitute 3 teaspoons of vanilla extract in place of the Bourbon if desired. This sauce is also wonderful if made with Rum."
"Coconut Macaroons With Chocolate Drizzle","","24","flour,sweetened coconut,salt,vanilla extract,sweetened condensed milk","Combine the flour, coconut and salt in a large bowl.\nIn a smaller bowl, combine the vanilla and the can of sweetened condensed milk and mix well.\nAdd this goo to the dry ingredients and mix with a wooden spoon, or you could use your hands (sounds rather messy to me). I probably wouldn't use a mixer unless it's on a super low speed. This batter is going to be THICK.\nLine baking sheets with parchment paper, and, using a big spoon or ice cream scooper, scoop the batter/dough onto the sheets.\nIn a preheated 350 degree oven, bake the macaroons for about 20 minutes, or until golden/toasty looking.\nDrizzle some melted semi-sweet chocolate on top or use a chocolate/baker's chocolate mix and go for the dipped variety."
"Banana Milo Milkshake","side dish","1","almond milk,banana,chocolate malt powder,strawberries,vanilla ice cream,whipped cream","<p>In a blender, pour in your milk, milo, banana and ice-cream and blend till smooth.Pour into a glass, spray the whipped cream on top and sprinkle the chopped strawberries on top.Serve cool.    For those that asked, here is a link on how to make whipped cream.</p>"
"Easy Tomato Basil Chicken – One Pot Meal","lunch","6","extra-virgin olive oil,bell pepper,cooked chicken breast,fresh basil,tomato & basil sauce,rotini pasta","Instructions\n\nCook the Rotini pasta according to the instructions. Drain. \n\nIn a medium saucepan, saute the bell pepper for 3 minutes in olive oil. \n\nAdd in tomato basil sauce, cooked rotini, chopped chicken and cook covered for 10 - 15 minutes. Stir frequently. \n\nRemove from heat and top with fresh chopped basil before serving."
"Avocado Toast With Caramelized Sweet Onion, Grape Tomatoes, Fresh Garden Chives and Chive Blossoms","","2","olive oil,yellow onion,grape tomatoes,avocado,bread,chives,chive,salt,ground pepper","Saute sliced onions and tomatoes with olive oil over medium high heat for 5-8 minutes. Season with salt and pepper. Set aside.\nToast two slices of bread in a toaster.\nEvenly smear avocado onto each slice of toast. Sprinkle with salt and pepper.\nTop toast with onions and tomatoes.\nGarnish with fresh chives and chive blossoms."
"Coffee Cookies","dessert","16","cake flour,sugar,instant coffee granules,walnuts,salt,canola oil,water,raisins,powdered sugar","Preheat oven to 350 degrees F and line a cookie sheet with parchment paper.\nPut the cake flour, sugar, coffee, walnuts, and salt in a food processor and process for about 10 seconds (or until the walnuts are well grounded).\nNow put the mixture into a mixing bowl and add canola oil. Form a pasty dough, then separate the dough with your hands to form small crumbs. Add the water and form into a clean dough. If you like raisins, you can combine it with the dough now.\nDivide the dough into 16 pieces and roll each piece into a ball. Put each ball on a cookie sheet and bake at 350 degrees F for 25 minutes.\nLet the cookies cool for about 20 minutes. Dust with powdered sugar before serving."
"Black Forest Mini Cheesecakes","side dish","12","cherry pie filling,cocoa powder,cream cheese,eggs,gelatin,heavy cream,oreo cookies,powdered sugar,salt,semi sweet chocolate chips,sour cream,sugar,unsalted butter,vanilla extract,water","<ol><li>1. Preheat oven to 325 degrees. In a medium bowl, mix together crushed Oreos and melted butter. Line a standard sized muffin tin with paper liners. Add a heaping tablespoon of the cookie crumb mixture to each liner, press with the back of a spoon to form the crust. Bake for 5 minutes. Remove from the oven, set aside to cool while preparing the filling.</li><li>2. In a small bowl stir together sugar, cocoa powder and salt. In a large mixing bowl add soften cream cheese and sugar/cocoa mix. Beat with an electric mixer until smooth, add melted chocolate, heavy cream and sour cream, beat until combined. Add eggs, one at a time and mix well after each, then add in vanilla. Tap the bowl on the counter firmly a couple of times to release any air bubbles.</li><li>3. Divide batter between the cupcake liners (liners will be full). Tap the pan a couple of times to be sure there are no large air bubble. Bake for 15-20 minutes, until the centers jiggle just slightly. (Original recipe called for baking time of 17-20 minutes, mine were done at the 15 minute mark.) Remove pan from oven, let cool at room temp. for 1 hour. Cover in plastic wrap and refrigerate for 2 hours or until fully cooled before topping.</li><li>4. Top the cheesecakes: In a medium bowl whisk together heavy cream, powdered sugar and vanilla. Place the bowl in the refrigerator, along with the beaters from your mixer, for 10-15 minutes to get everything well chilled. Add gelatin to a small bowl, add water. When gelatin absorbs all the water microwave for about 10 seconds to heat and melt the gelatin and make it pourable. Set aside to cool a bit. Beat the cream until just before it reaches soft peak stage, check your gelatin to be sure it has cooled slightly but is still a pourable consistency (if it solidified, just pop it back in the microwave for a couple seconds). With the mixer running, slowly pour in the gelatin and finish whipping the cream to soft peak stage.</li><li>5. Top the cakes with a generous spoon full of the whipped cream, using the back of a spoon make a little nest indentation in the top for the cherry filling. Add a spoon full of the cherry filling and you're done.</li></ol>"
"Vietnamese Pancakes with Vegetables, Herbs and a Fragrant Dipping Sauce (Bánh Xèo)","side dish","6","brown rice flour,brown sugar,carrot,cayenne,coconut milk,daikon radish,egg,enoki mushrooms,fresh basil leaves,fresh ginger,fresh mint leaves,fresh parsley,garlic,green chili,green chilies,green onions,juice of lime,mung bean sprouts,red chilies,rice vinegar,sea salt,sesame oil,sesame oil,snow peas,tamari soy sauce,turmeric","Begin by preparing the pancake batter. Whisk together the rice flour, egg, sea salt, turmeric, cayenne and green chili. Gradually whisk in the coconut milk. The mixture should be a smooth, semi-thick batter that is of pouring consistency. Add a little water if necessary. Cover and set aside while you prepare the rest of the food.Now prepare the sauce. Whisk together all of the ingredients and set aside.For the filling, combine the carrot, radish, green onions, green chilies and snow peas. Put the herbs in another bowl and have your sprouts ready along with the mushrooms.Heat a teaspoon of oil over medium heat in a non-stick skillet. When hot, ladle 1/2 cup of batter into the pan and spread with the bottom of the ladle until you have a roughly 6 to 8 inch pancake.  Fry for 6 to 8 minutes or until you have small holes forming and the bottom is crispy brown, then flip and fry for another few minutes on the other side. Transfer to a plate and keep warm in a 150 oven while you finish the rest of the pancakes  you should finish with 4 to 6 pancakes.To serve, scatter a portion of the vegetables, herbs and mushrooms over one half of the pancake. Sprinkle some sauce over top and fold the pancake. Drizzle with more sauce and there you go."
"Caprese Quick Bread","morning meal","12","flour,white whole wheat flour,baking powder,salt,dried basil,mozzarella cheese,olive oil,whole egg,non-fat milk,sundried tomatoes,butter","Heat oven to 350. Spray a 9x5x3 loaf pan or two mini bread pans with cooking spray.\nStir together flours,cheese, baking powder, basil and salt in medium bowl. Add olive oil, egg and milk, stir till combined. Fold in sundried tomatoes.\nPour into pan, drizzle melted butter over top of bread. (Bread will be thick, flatten it out with your fingers)\nBake 30 minutes for mini loaf pans and 40  50 minutes for large loaf pan, or until golden brown and toothpick inserted in center comes out clean. Cool 5 minutes, remove from pan to wire rack. Cool 30 minutes before slicing, if you can control yourself!"
"Chili Pie with Green Chile and Cheddar Cornbread Crust","lunch","8","baking powder,butter,canned cannelini beans,canned diced tomatoes,chile powder,cinnamon,cornmeal,cumin,eggs,extra sharp cheddar cheese,flour,frozen corn,garlic,green chiles,kosher salt,milk,nutmeg,olive oil,oregano,smoked paprika,sour cream,table salt,water,worcestershire sauce,yellow onions","<ol><li>In a large skillet saute onion in oil until soft and translucent, seasoning with salt and pepper. Add garlic and saute until fragrant. Remove 2/3 of the mixture from pan and set aside. Add green chilies with their juices and saute for 2-3 minutes. Remove and set aside in a separate bowl.</li><li>In the same skillet brown ground beef, crumbling it as it cooks. When cooked through carefully drain grease. Add the onion mixture, chili powder, Worcestershire, oregano, paprika, cinnamon, nutmeg, and water. Mix thoroughly and continue cooking over medium-low heat as you add the tomatoes with juices, the beans and corn. Mix well and cook for 3-4 minutes.</li><li>Preheat oven to 400 degrees and grease a 9x13 inch casserole dish. Pour the meat mixture in and spread evenly over bottom. Sprinkle two cups of the cheese over top.</li><li>In a large bowl combine the flour, cornmeal, baking powder and salt.</li><li>In a separate medium bowl whisk the eggs, milk, butter and sour cream. Add this mixture to the dry mix and stir together.</li><li>Add the onion/green chile mixture and the remaining cup of cheese. Stir in. Pour over top of the meat mixture. Spread evenly. Sprinkle Chile powder over top.</li><li>Bake 25-30 minutes or until a toothpick comes clean from center of cornbread. Let set for 10 minutes before serving.</li></ol>"
"Favorite Moist Chocolate Cake","side dish","12","baking cocoa,baking powder,baking soda,bittersweet chocolate,coffee,cream cheese,eggs,flour,heavy cream,milk,oil,salt,strawberries,sugar,vanilla","<ol><li>To Make Cake:</li><li>Sift together dry ingredients. Add oil, coffee and milk. Whisk until combined. Add eggs and vanilla. Whisk until well incorperated (about 2 min.). It will be quite runny.</li><li>Grease and flour 2- 9 inch round pans. Pour the batter into the pans and bake at 325F for 25-30 min until a toothpick inserted into the centre comes out clean.</li><li>Let the cakes cool in the pans for 10 min. before removing to cool completely.</li><li>To Make Strawberry Mousse:</li><li>Mix together the cream cheese and sugar until completely smooth. Mix in the pureed strawberries.</li><li>Whip the cream to stiff peaks and fold into the strawberry cream cheese mixture.</li><li>Line a 9 inch round pan (the same size you used for the cakes) with plastic wrap and pour the mousse inside. Freeze until solid.</li><li>To Make Ganache:</li><li>Bring cream to a boil over medium heat.</li><li>Poor over chocolate. Let sit for a moment then stir until smooth.</li><li>Let cool to room temp.</li><li>To Assemble:</li><li>Remove mousse from freezer and unwrap.</li><li>Place one cake layer on serving platter. Position frozen mousse in the centre and top with remaining cake layer.</li><li>Allow to thaw for 30 min, or so.</li><li>Meanwhile drizzle with ganache and garnish with fresh strawberries.</li></ol>"
"Tomato Cutlets","lunch","5","baby eggplant,beefsteak tomatoes,bread crumbs,eggs,juice of lemon,olive oil,parsley,pepper,romano cheese,salt","<ol><li>Prepare the eggs, bread crumbs and sliced tomatoes.</li><li>Dip the tomato slice in the egg wash and then in the bread crumbs.  If you have extra egg wash and bread crumbs you can repeat this process.</li><li>Heat a large frying pan with the olive oil and place the prepared tomato slices in the pan.  When the tomatoes have a nice golden color gently flip and finish cooking on the other side.  This will take about 3-4 minutes on each side on medium heat.</li><li>Place halved eggplant in the frying pan and sprinkle with dashes of salt and pepper.  Let the eggplant saut on one side to a golden color then turn and saut on the other side.  This will take about 3  4 minutes on each side.</li><li>Plate and finish with the parsley garnish, lemon juice and grated cheese.</li></ol>"
"Crockpot Garlic Lime Salsa Meatball Tacos","lunch","4","egg,garlic,ground beef,lime zest,picante sauce,salt,tortilla chip scoops,tortillas",""
"Vanilla Cream Cakes, Easy and Fluffy Holiday Cakes","dessert","15","puff pastry,eggs,sugar,sugar,sugar,rum,milk,vanilla sugar,all purpose flour,heavy whipping cream,sugar","You can also check recipe video here: http://www.youtube.com/watch?v=U9Mqqrv02H4\nPreheat the oven on 200 C (about 390 F).\nSize of the baking dish: around 14 inch long, 10 inch wide, 3.2 inch deep\nRoll the pastry thin, in to the size of your baking dish. You should roll half of pastry for the bottom side of cakes and half of pastry for upper side off the cakes. The size should be just a little bigger than the size of your baking dish.\nBake the pastry for about 10-15 minutes until golden brown. Cool the upper layer completely. Leave the second one (bottom layer) in the baking dish.\nDivide egg yolks from egg whites, putting egg whites in to the larger bowl.\nFor the egg yolk mixture, add sugar, vanilla and rum to the egg yolks into a smaller bowl. Mix them together for a minute or two. Add flour and 1/4 off milk and mix together to get a smooth mixture.\nMix egg whites in the large bowl until firm consistency. Then add sugar and mix again. The consistency after adding the sugar should be very firm.\nPut the rest of the milk in to a large cooking pot and bring it to boiling point. Take a whisk and slowly pour the egg yolk mixture in to boiling milk, whisking the whole time. Cook it for 5 minutes, whisking the whole time. After 5 minutes the consistency should be thick and very hard for you to whisk.\nNOW THE CRUCIAL AN THE HARDEST PART  IT IS BETTER THAT TWO PERSONS DO THIS\nTake the boiling mixture of the stove. Pour it in into egg whites very slowly at first. Whisk the whole time.  When you see both mixtures getting nicely mixed together in to a thicker mixture pour the boiling mixture faster into egg whites, until the end. When mixed, immediately pour the mixture in to the baking dish in which you have the bottom layer of baked pastry.\nShake the baking dish slightly so that every corner of pastry gets field, and leave it to cool (best is over night in the refrigerator).\nMix sugar and whipping cream in a bowl. Put whipped cream on the top off the cooled mixture.\nTake the other baked pastry and cut it in to 15 same sized squares. Put the squares on to the whipped cream.\nJust before serving cut the cakes in to squares and sprinkle powdered sugar on top."
"Apple Roasted Pork Loin","lunch","6","pork loin,granny smith apples,olive oil,garlic,honey,apple cider vinegar,pepper,sea salt,five spice powder,nutmeg","<p>Apple Roasted Pork Loin</p><p>Apples and pork is a pretty traditional combination and I couldn't count the number of ways I've put the two together in the past but this one is a little different. The Granny Smith apples are diced quite small and then cooked in a reduction of honey, apple cider vinegar and spices. Granny Smiths are good to use because they won't break down into apple sauce during the cooking. The cooked apples are then used as a top crust and glaze for the roast pork. Some garlic roast potatoes and steamed veggies completed a wonderful family meal. Here's your Sunday supper!</p><p>Lb pork loin or rib roast</p><p>Season the pork with salt and pepper and open roast on a rack in a roasting pan at 375 degrees F for about a half hour.</p><p>Meanwhile dice very small, (about a 1/4 inch dice)</p><p>Large Granny Smith apples, peeled and cored</p><p>In a large saute pan over medium heat add:</p><p>Tbsp olive oil</p><p>Cloves minced garlic</p><p>Cook for a minute or two to soften but not brown the garlic. Add:</p><p>Cup honey</p><p>Cup apple cider vinegar</p><p>Tsp pepper</p><p>Tsp sea salt</p><p>Teaspoon Chinese five spice powder</p><p>Tsp freshly grated nutmeg</p><p>Bring the mixture to a boil and simmer until the volume is reduced by about half. Increase the heat to mediun-high. Add the diced apple and cook, stirring occasionally until most of the liquid has reduced off.</p><p>After half an hour in the oven, take the roast out and spoon the apples all over the top. Return the roast to the oven, reduce the heat to 350 degrees F and cook uncovered until the internal temperature reaches 170 degrees F on a meat thermomether inserted into the center of the roast. Allow the pork to rest for about 15 minutes before carving and serving.</p>"
